Title,Link,Country,Keywords,Sentiment Score,Sentiment,Impact on Country
The World Factbook,https://www.cia.gov/the-world-factbook/countries/angola/,Unknown,"World Factbook, Factbook Visit, Notes page, World, Factbook",0.491165906,Positive,Likely Positive
The World Factbook,https://www.cia.gov/the-world-factbook/countries/anguilla/,Unknown,"World Factbook, Factbook Anguilla, Leeward Islands, scrub-covered coral, Caribbean",0.948237782,Positive,Likely Positive
The World Factbook,https://www.cia.gov/the-world-factbook/countries/antarctica/,Unknown,"World Factbook, Factbook Visit, Notes page, World, Factbook",0.491165906,Positive,Likely Positive
Antigua and Barbuda,https://www.cia.gov/the-world-factbook/countries/antigua-and-barbuda/,Unknown,"Barbuda, Antigua, photos",-0.645855604,Negative,Likely Negative
The World Factbook,https://www.cia.gov/the-world-factbook/countries/argentina/,Unknown,"World Factbook, Factbook Visit, Notes page, World, Factbook",0.491165906,Positive,Likely Positive
The World Factbook,https://www.cia.gov/the-world-factbook/countries/armenia/,Unknown,"World Factbook, Factbook Visit, Notes page, World, Factbook",0.491165906,Positive,Likely Positive
About CIA,https://www.cia.gov/about/,Unknown,"Collect foreign, Produce objective, Conduct covert, national security, covert action",0.749773719,Positive,Likely Positive
Director of the CIA,https://www.cia.gov/about/director-of-cia/,Unknown,"CIA Director, National Intelligence, Director, CIA Role, CIA",0.988196217,Positive,Likely Positive
Organization,https://www.cia.gov/about/organization/,Unknown,"Central Intelligence, Intelligence Agency, Organization CIA, Mission Centers, independent agency",0.957346422,Positive,Likely Positive
Mission and Vision,https://www.cia.gov/about/mission-vision/,Unknown,"Producing objective, Collecting foreign, Conducting effective, security objectives, objective all-source",0.927203122,Positive,Likely Positive
CIA Museum,https://www.cia.gov/legacy/museum/,Unknown,"CIA Museum, robotic bug, CIA, Museum, bug",0.964902522,Positive,Likely Positive
Careers,https://www.cia.gov/careers/,Unknown,"Agency defined, Careers, mission, people, Agency",-0.004748295,Neutral,Likely Negative
How We Hire,https://www.cia.gov/careers/how-we-hire/,Unknown,"CIA professionals, highest standards, join CIA, Hire, CIA",0.975612118,Positive,Likely Positive
Student Programs,https://www.cia.gov/careers/student-programs/,Unknown,"Stokes Scholarship, Scholarship Program, Programs Stokes, tuition assistance, Student Programs",-0.296757611,Negative,Likely Negative
Accessibility and Accommodations,https://www.cia.gov/careers/working-at-cia/accessibility/,Unknown,"Accommodations CIA, Central Intelligence, Intelligence Agency, CIA Website, Rehabilitation Act",0.165765264,Positive,Likely Positive
CIA CareerLINK,https://www.cia.gov/ehl/,Unknown,"CIA CareerLINK, CIA, CareerLINK",0.374060422,Positive,Likely Positive
News and Stories,https://www.cia.gov/stories/,Unknown,"United States, Stories Twenty-three, Twenty-three years, years ago, Twenty-three",0.968333784,Positive,Likely Positive
Center for the Study of Intelligence,https://www.cia.gov/resources/csi/,Unknown,"Intelligence Community, core mission, Intelligence, Intelligence CSI, CSI",0.056129781,Positive,Likely Positive
The World Factbook,https://www.cia.gov/the-world-factbook,Unknown,"World Factbook, Factbook legislative, bicameral legislatures, legislative branch, lower chambers",-0.635002254,Negative,Likely Negative
World Leaders,https://www.cia.gov/resources/world-leaders/,Unknown,"World Leaders, United States, CIA publishes, Foreign Governments, Leaders",-0.095407301,Negative,Likely Negative
The Langley Files,https://www.cia.gov/podcast/the-langley-files,United States,"Langley Files, Langley, Central Intelligence, Intelligence Agency, CIA Headquarters",0.841692074,Positive,Likely Positive
Spy Kids,https://www.cia.gov/spy-kids/,Unknown,"Bill Burns, Intelligence Agency, Central Intelligence, Spy Kids, CIA",0.990510687,Positive,Likely Positive
Partner with CIA,https://www.cia.gov/partner-with-cia,Unknown,"Business Day, CIA Emerging, Held annually, Emerging Business, held virtually",0.963297446,Positive,Likely Positive
Freedom of Information Act Electronic Reading Room,https://www.cia.gov/readingroom/,Unknown,"Information Act, Act Electronic, Electronic Reading, Reading Room, President Nixon",0.903642587,Positive,Likely Positive
Frequently Asked Questions,https://www.cia.gov/faqs,Unknown,"Questions Technically, Asked Questions, Frequently Asked, CIA headquarters, Langley",0.860265404,Positive,Likely Positive
Privacy,https://www.cia.gov/privacy_policy,Unknown,"Intelligence Agency, Central Intelligence, information, Civil Liberties, ’re committed",-0.098841905,Negative,Likely Negative
Report Information,https://www.cia.gov/report-information,Unknown,"United States, Federal Bureau, law enforcement, imminent threat, enforcement office",-0.016412887,Neutral,Likely Negative
Contact CIA,https://www.cia.gov/contact-cia,Unknown,"Civil Liberties, Report Information, collection mission, CIA Information, CIA",-0.016117278,Neutral,Likely Negative
Central Intelligence Agency (CIA),https://www.facebook.com/Central.Intelligence.Agency,Unknown,"Intelligence Agency, Central Intelligence, CIA, Agency, Intelligence",0.374060422,Positive,Likely Positive
x.com,https://twitter.com/cia,Unknown,x.com,0.374060422,Positive,Likely Positive
Central Intelligence Agency,https://www.linkedin.com/company/central-intelligence-agency,United States,"ever-changing political, military landscapes, providing global, Intelligence Agency, global intelligence",0.997062961,Positive,Likely Positive
Central Intelligence Agency,https://www.youtube.com/cia,Unknown,"Intelligence Agency, Central Intelligence, Agency, Intelligence, Central",0.374060422,Positive,Likely Positive
Central Intelligence Agency,https://www.flickr.com/ciagov,Unknown,"Intelligence Agency, Central Intelligence, public photos, Intelligence, Agency",-0.647845505,Negative,Likely Negative
Telegram: Contact @securelycontactingcia,https://t.me/s/securelycontactingcia,Unknown,"Contacting CIA, Securely Contacting, securelycontactingcia Securely, Contact, global mission",0.78474685,Positive,Likely Positive
Search CIA.gov,https://www.cia.gov/search,Unknown,"Leaders Careers, Careers CSI, CSI FOIA, World Factbook, Factbook World",-0.337444987,Negative,Likely Negative
Site Policies,https://www.cia.gov/site-policies,Unknown,"Intelligence Agency, Central Intelligence, Site Policies, civil liberties, information",-0.072051307,Negative,Likely Negative
Office of Privacy and Civil Liberties,https://www.cia.gov/about/organization/privacy-and-civil-liberties,United States,"Civil Liberties, Liberties Collecting, States Government, United States, including freedoms",0.987405638,Positive,Likely Positive
No FEAR Act,https://www.cia.gov/about/organization/equal-employment-opportunity/no-fear-act,Unknown,"FEAR Act, President Bush, Retaliation Act, Federal Employee, Employee Anti-discrimination",-0.04090569,Neutral,Likely Negative
Elijah Cummings Act,https://www.cia.gov/about/organization/equal-employment-opportunity/elijah-cummings-act,Unknown,"Cummings Act, Elijah Cummings, Cummings Federal, Employee Antidiscrimination, Antidiscrimination Act",-0.094186007,Negative,Likely Negative
Office of Inspector General,https://www.cia.gov/about/organization/inspector-general,Unknown,"CIA programs, Inspector General, Office, Audits, OIG promotes",0.379155607,Positive,Likely Positive
Making government services easier to find,https://www.usa.gov/,United States,"United States, States government, Making government, services easier, official website",-0.265366925,Negative,Likely Negative
CIA.gov Sitemap,https://www.cia.gov/sitemap,Unknown,"CIA.gov Sitemap, Sitemap CSI, Intelligence, CSI, Sitemap",-0.205415521,Negative,Likely Negative
world climate guide,https://www.climatestotravel.com/#main_content,Unknown,"climate guide, guide Climates, Average weather, Choose, pack Choose",0.898165754,Positive,Likely Positive
world climate guide,https://www.climatestotravel.com/,Unknown,"climate guide, guide Climates, Average weather, Choose, pack Choose",0.898165754,Positive,Likely Positive
world climate guide,https://www.climatestotravel.com/,Unknown,"climate guide, guide Climates, Average weather, Choose, pack Choose",0.898165754,Positive,Likely Positive
list of the countries,https://www.climatestotravel.com/continents/africa,Unknown,"Africa Facebook, Facebook Twitter, Whatsapp Email, Email Share, Prevailing weather",0.81376029,Positive,Likely Positive
list of the countries,https://www.climatestotravel.com/continents/north-america,Unknown,"North America, America Facebook, Facebook Twitter, Whatsapp Email, Email Share",0.811034451,Positive,Likely Positive
list of the countries,https://www.climatestotravel.com/continents/south-america,Unknown,"South America, America Facebook, Facebook Twitter, Whatsapp Email, Email Share",0.811218212,Positive,Likely Positive
list of the countries,https://www.climatestotravel.com/continents/antarctica,Unknown,"Antarctica Facebook, Facebook Twitter, Whatsapp Email, Email Share, Prevailing weather",0.801110188,Positive,Likely Positive
list of the countries,https://www.climatestotravel.com/continents/asia,Unknown,"Asia Facebook, Facebook Twitter, Whatsapp Email, Email Share, Prevailing weather",0.82879589,Positive,Likely Positive
list of the countries,https://www.climatestotravel.com/continents/caribbean,Unknown,"Caribbean Facebook, Facebook Twitter, Whatsapp Email, Email Share, Prevailing weather",0.82961006,Positive,Likely Positive
list of the countries,https://www.climatestotravel.com/continents/europe,Unknown,"Europe Facebook, Facebook Twitter, Whatsapp Email, Email Share, Prevailing weather",0.812716673,Positive,Likely Positive
list of the countries,https://www.climatestotravel.com/continents/middle-east,Unknown,"Middle East, East Facebook, Facebook Twitter, Whatsapp Email, Email Share",0.768368552,Positive,Likely Positive
list of the countries,https://www.climatestotravel.com/continents/oceania,Unknown,"Oceania Facebook, Facebook Twitter, Whatsapp Email, Email Share, Prevailing weather",0.804829101,Positive,Likely Positive
Climates of the world,https://www.climatestotravel.com/world-climates/countries,Unknown,"Clickable map, world Clickable, Clickable, continents, countries",0.495208949,Positive,Likely Positive
world climate guide,https://www.climatestotravel.com/,Unknown,"climate guide, guide Climates, Average weather, Choose, pack Choose",0.898165754,Positive,Likely Positive
list of the countries,https://www.climatestotravel.com/continents/africa,Unknown,"Africa Facebook, Facebook Twitter, Whatsapp Email, Email Share, Prevailing weather",0.81376029,Positive,Likely Positive
list of the countries,https://www.climatestotravel.com/continents/north-america,Unknown,"North America, America Facebook, Facebook Twitter, Whatsapp Email, Email Share",0.811034451,Positive,Likely Positive
list of the countries,https://www.climatestotravel.com/continents/south-america,Unknown,"South America, America Facebook, Facebook Twitter, Whatsapp Email, Email Share",0.811218212,Positive,Likely Positive
list of the countries,https://www.climatestotravel.com/continents/antarctica,Unknown,"Antarctica Facebook, Facebook Twitter, Whatsapp Email, Email Share, Prevailing weather",0.801110188,Positive,Likely Positive
list of the countries,https://www.climatestotravel.com/continents/asia,Unknown,"Asia Facebook, Facebook Twitter, Whatsapp Email, Email Share, Prevailing weather",0.82879589,Positive,Likely Positive
list of the countries,https://www.climatestotravel.com/continents/caribbean,Unknown,"Caribbean Facebook, Facebook Twitter, Whatsapp Email, Email Share, Prevailing weather",0.82961006,Positive,Likely Positive
list of the countries,https://www.climatestotravel.com/continents/europe,Unknown,"Europe Facebook, Facebook Twitter, Whatsapp Email, Email Share, Prevailing weather",0.812716673,Positive,Likely Positive
list of the countries,https://www.climatestotravel.com/continents/middle-east,Unknown,"Middle East, East Facebook, Facebook Twitter, Whatsapp Email, Email Share",0.768368552,Positive,Likely Positive
list of the countries,https://www.climatestotravel.com/continents/oceania,Unknown,"Oceania Facebook, Facebook Twitter, Whatsapp Email, Email Share, Prevailing weather",0.804829101,Positive,Likely Positive
Climates of the world,https://www.climatestotravel.com/world-climates/countries,Unknown,"Clickable map, world Clickable, Clickable, continents, countries",0.495208949,Positive,Likely Positive
list of the countries,https://www.climatestotravel.com/continents/africa,Unknown,"Africa Facebook, Facebook Twitter, Whatsapp Email, Email Share, Prevailing weather",0.81376029,Positive,Likely Positive
list of the countries,https://www.climatestotravel.com/continents/north-america,Unknown,"North America, America Facebook, Facebook Twitter, Whatsapp Email, Email Share",0.811034451,Positive,Likely Positive
list of the countries,https://www.climatestotravel.com/continents/south-america,Unknown,"South America, America Facebook, Facebook Twitter, Whatsapp Email, Email Share",0.811218212,Positive,Likely Positive
list of the countries,https://www.climatestotravel.com/continents/antarctica,Unknown,"Antarctica Facebook, Facebook Twitter, Whatsapp Email, Email Share, Prevailing weather",0.801110188,Positive,Likely Positive
list of the countries,https://www.climatestotravel.com/continents/asia,Unknown,"Asia Facebook, Facebook Twitter, Whatsapp Email, Email Share, Prevailing weather",0.82879589,Positive,Likely Positive
list of the countries,https://www.climatestotravel.com/continents/caribbean,Unknown,"Caribbean Facebook, Facebook Twitter, Whatsapp Email, Email Share, Prevailing weather",0.82961006,Positive,Likely Positive
list of the countries,https://www.climatestotravel.com/continents/europe,Unknown,"Europe Facebook, Facebook Twitter, Whatsapp Email, Email Share, Prevailing weather",0.812716673,Positive,Likely Positive
list of the countries,https://www.climatestotravel.com/continents/middle-east,Unknown,"Middle East, East Facebook, Facebook Twitter, Whatsapp Email, Email Share",0.768368552,Positive,Likely Positive
list of the countries,https://www.climatestotravel.com/continents/oceania,Unknown,"Oceania Facebook, Facebook Twitter, Whatsapp Email, Email Share, Prevailing weather",0.804829101,Positive,Likely Positive
"Australia climate: average weather, temperature, rain",https://www.climatestotravel.com/climate/australia,Australia,"rain Select, Select units, Average temperatures, Month Min, average weather",-0.406468242,Negative,Likely Negative
"Costa Rica climate: average weather, temperature, rain",https://www.climatestotravel.com/climate/costa-rica,Unknown,"Costa Rica, Select units, rain Select, Rica climate, rainfall tables",-0.058993608,Negative,Likely Negative
"Dubai climate: weather by month, temperature, rain",https://www.climatestotravel.com/climate/united-arab-emirates/dubai,Unknown,"Select units, rain Select, rainfall tables, Dubai climate, February",-0.113986258,Negative,Likely Negative
"India climate: average weather, temperature, rain",https://www.climatestotravel.com/climate/india,India,"Arid Northwest, Northwest Thar, islands West, Index Himalaya, Center-South South-east",-0.901422896,Negative,Likely Negative
"Ireland climate: average weather, temperature, rain",https://www.climatestotravel.com/climate/ireland,Unknown,"Select units, Malin Head, Average temperatures, average weather, rain Select",-0.435693175,Negative,Likely Negative
"Japan climate: average weather, temperature, rain",https://www.climatestotravel.com/climate/japan,Japan,"Select units, Average temperatures, rain Select, average weather, Min Max",-0.467527896,Negative,Likely Negative
"Tokyo climate: weather by month, temperature, rain",https://www.climatestotravel.com/climate/japan/tokyo,Unknown,"Select units, rain Select, rainfall tables, February, October",0.80919313,Positive,Likely Positive
"Portugal climate: average weather, temperature, rain",https://www.climatestotravel.com/climate/portugal,Unknown,"Select units, rain Select, Average temperatures, average weather, rainfall tables",-0.353201985,Negative,Likely Negative
"Qatar climate: average weather, temperature, rain",https://www.climatestotravel.com/climate/qatar,Unknown,"Select units, rain Select, average weather, rainfall tables, Month Average",-0.062826455,Negative,Likely Negative
"Spain climate: average weather, temperature, rain",https://www.climatestotravel.com/climate/spain,Unknown,"Select units, rain Select, rainfall tables, February, March",0.524834215,Positive,Likely Positive
"Thailand climate: average weather, temperature, rain",https://www.climatestotravel.com/climate/thailand,Unknown,"Chiang Mai, Select units, rain Select, rainfall tables, February",-0.161256344,Negative,Likely Negative
"United Kingdom climate: average weather, temperature, rain",https://www.climatestotravel.com/climate/united-kingdom,United Kingdom,"United Kingdom, Atlantic Ocean, Kingdom climate, rain United, small temperature",0.861736337,Positive,Likely Positive
"London climate: weather by month, temperature, rain",https://www.climatestotravel.com/climate/england/london,Unknown,"Select units, rain Select, rainfall tables, March, April",-0.152048294,Negative,Likely Negative
"United States climate: average weather, temperature, rain",https://www.climatestotravel.com/climate/united-states,United States,"United States, States climate, Select units, Average temperatures, rain Select",-0.384878308,Negative,Likely Negative
"Miami climate: weather by month, temperature, rain",https://www.climatestotravel.com/climate/united-states/miami,Unknown,"Select units, rain Select, rainfall tables, June, Min Max",0.665100409,Positive,Likely Positive
"New York climate: weather by month, temperature, rain",https://www.climatestotravel.com/climate/united-states/new-york,Unknown,"Select units, rain Select, rainfall tables, February, June",0.813611474,Positive,Likely Positive
Climates of the world,https://www.climatestotravel.com/world-climates/countries,Unknown,"Clickable map, world Clickable, Clickable, continents, countries",0.495208949,Positive,Likely Positive
Where to go on holiday,https://www.climatestotravel.com/where-togo,Unknown,"Nordic winter.Furthermore, Nordic country, Christmas, Nordic, cold",0.977097233,Positive,Likely Positive
climatestotravel.com,https://www.facebook.com/Climatestotravel,Unknown,climatestotravel.com,0.374060422,Positive,Likely Positive
Log into Facebook,https://facebook.com/sharer/sharer.php?u=https://www.climatestotravel.com/,Unknown,"Facebook Notice, Facebook, Notice, continue, Log",-0.482138813,Negative,Likely Negative
x.com,https://twitter.com/intent/tweet?text=Climates%20to%20Travel%20-%20world%20climate%20guide&url=https://www.climatestotravel.com/,Unknown,x.com,0.374060422,Positive,Likely Positive
"LinkedIn Login, Sign in",https://www.linkedin.com/shareArticle?mini=true&url=https://www.climatestotravel.com/,Unknown,"LinkedIn Login, address Click, LinkedIn account, one-time link, ’ve emailed",-0.49860695,Negative,Likely Negative
Email Protection,https://www.climatestotravel.com/cdn-cgi/l/email-protection#95aae6e0f7fff0f6e1a8d6f9fcf8f4e1f0e6b0a7a5e1fab0a7a5c1e7f4e3f0f9b0a7a5b8b0a7a5e2fae7f9f1b0a7a5f6f9fcf8f4e1f0b0a7a5f2e0fcf1f0b3f4f8e5aef7faf1eca8fde1e1e5e6afbabae2e2e2bbf6f9fcf8f4e1f0e6e1fae1e7f4e3f0f9bbf6faf8ba,Unknown,"Email Protection, Protection, Email addresses, Cloudflare, Email",-0.157574873,Negative,Likely Negative
world climate guide,https://www.climatestotravel.com/,Unknown,"climate guide, guide Climates, Average weather, Choose, pack Choose",0.898165754,Positive,Likely Positive
Climates to travel,https://www.climatestotravel.com/info/about,Unknown,"finding information, Nowadays, Internet, information, difficult",-0.171288988,Negative,Likely Negative
Climates to travel,https://www.climatestotravel.com/info/contact,Unknown,"SEO reports, HTML error, guest posting, advertising partnership, fixation proposals",-0.33596833,Negative,Likely Negative
Climates to travel,https://www.climatestotravel.com/info/link,Unknown,"Climates, travel",0.374060422,Positive,Likely Positive
Climates to travel,https://www.climatestotravel.com/info/policy,Unknown,"travel policy, social media, Cookies, privacy policy, preferences",-0.253313901,Negative,Likely Negative
world climate guide,https://www.climatestotravel.com/,Unknown,"climate guide, guide Climates, Average weather, Choose, pack Choose",0.898165754,Positive,Likely Positive
Climates to travel,https://www.climatestotravel.com/info/about,Unknown,"finding information, Nowadays, Internet, information, difficult",-0.171288988,Negative,Likely Negative
Climates to travel,https://www.climatestotravel.com/info/contact,Unknown,"SEO reports, HTML error, guest posting, advertising partnership, fixation proposals",-0.33596833,Negative,Likely Negative
Climates to travel,https://www.climatestotravel.com/info/link,Unknown,"Climates, travel",0.374060422,Positive,Likely Positive
Climates to travel,https://www.climatestotravel.com/info/policy,Unknown,"travel policy, social media, Cookies, privacy policy, preferences",-0.253313901,Negative,Likely Negative
Country Commercial Guides,https://www.trade.gov/country-commercial-guides/#main-content,Unknown,"Commercial Guides, Country Commercial, State Department, Guides Reports, Embassies worldwide",0.756698973,Positive,Likely Positive
Country Commercial Guides,https://www.trade.gov/country-commercial-guides/,Unknown,"Commercial Guides, Country Commercial, State Department, Guides Reports, Embassies worldwide",0.756698973,Positive,Likely Positive
International Trade Administration,https://www.trade.gov/,Unknown,"Trade Administration, International Trade, Trade, Administration, International",0.498673618,Positive,Likely Positive
Export Solutions,https://www.trade.gov/export-solutions,Unknown,"Export Solutions, Trade Administration, International Trade, Video element, Business Navigator",0.96344104,Positive,Likely Positive
Virtual Services,https://www.trade.gov/virtual-services,Unknown,"Due Diligence, Foreign Parties, Research Services, Services Matchmaking, Matchmaking Services",0.963152389,Positive,Likely Positive
Learn How To Export,https://www.trade.gov/learn-how-export,Unknown,"Export Follow, Business Navigator, three-phased journey, Global Business, Navigator ChatbotBeta",0.929098376,Positive,Likely Positive
Network and Learn at Events,https://www.trade.gov/network-and-learn-events,Unknown,"service providers, Events Participation, trade experts, domestic trade, local exporting",0.854654296,Positive,Likely Positive
Find Buyers and Partners,https://www.trade.gov/find-buyers-and-partners,Unknown,"Find Buyers, foreign buyers, Buyers, Partners, Find",0.871809957,Positive,Likely Positive
eCommerce,https://www.trade.gov/ecommerce,Unknown,"digital strategy, ecommerce Learn, Commercial Service, Trade Specialists, starting point",0.943123387,Positive,Likely Positive
Obtaining Finance,https://www.trade.gov/finance,Unknown,"Finance Make, Obtaining Finance, Make global, cash flow, global deals",0.698684606,Positive,Likely Positive
Negotiate an Export Sale,https://www.trade.gov/negotiate-export-sale,Unknown,"Payment Determine, Product Export, Total Export, Export Price, Options Price",0.917828284,Positive,Likely Positive
Navigate Shipping and Logistics,https://www.trade.gov/navigate-shipping-and-logistics,Unknown,"Logistics Ship, product stuck, Navigate Shipping, arrive safely, product",0.690710066,Positive,Likely Positive
Comply with U.S. and Foreign Regulations,https://www.trade.gov/comply-us-and-foreign-regulations,Unknown,"Regulations Successful, Foreign Regulations, Successful exporters, foreign import, import requirements",0.953887565,Positive,Likely Positive
Perform Due Diligence,https://www.trade.gov/perform-due-diligence,Unknown,"Commercial Guides, Guides Initial, Country Commercial, Profile Consolidated, Due Diligence",0.007051482,Neutral,Likely Positive
Protect Intellectual Property,https://www.trade.gov/protect-intellectual-property,Unknown,"Intellectual Property, Intellectual, Property, Property Intellectual, artistic works",0.005734494,Neutral,Likely Positive
Resolve a Trade Problem,https://www.trade.gov/resolve-trade-problem,Unknown,"Trade Remedy, Trade Problem, Foreign Trade, Remedy Actions, remedy investigation",-0.318280863,Negative,Likely Negative
Research Center,https://www.trade.gov/research-center,Unknown,"Center View, Industry ITA, Research Center, View Research, ITA delivers",0.795418916,Positive,Likely Positive
Visual Data Center,https://www.trade.gov/visual-data-center,Unknown,"Data Center, Visual Data, Data, Center, Hear",0.737469934,Positive,Likely Positive
Industries,https://www.trade.gov/industries,Unknown,"Tourism Increase, Increase exports, Industries Travel, tourism sector, latest updates",0.658745352,Positive,Likely Positive
Research By Country,https://www.trade.gov/research-country,Unknown,"make informed, United States, informed export, export decisions, Country",-0.074890498,Negative,Likely Negative
Research By Region,https://www.trade.gov/research-region,Unknown,"make informed, United States, informed export, export decisions, information important",-0.034847898,Neutral,Likely Negative
Trade Data and Analysis,https://www.trade.gov/trade-data-analysis,Unknown,"Analysis Explore, Analysis unit, analysis provided, Analysis, innovative tools",0.960982204,Positive,Likely Positive
Top Export Market Rankings,https://www.trade.gov/top-export-market-rankings,Unknown,"Top Export, Market Rankings, Export Market, Rankings Top, Analysis Office",0.989191321,Positive,Likely Positive
